{
  "schema_version": "1.0.0",
  "scanner": {
    "name": "global-capability-catalog",
    "version": "0.1.0"
  },
  "repo": {
    "id": "github-recent__mbarbine__v0-fortune-cookie-windshield-pz",
    "name": "mbarbine__v0-fortune-cookie-windshield-pz",
    "path": "/Users/bwm.barbinewarnermichael/Documents/github/repositories/github-recent/mbarbine__v0-fortune-cookie-windshield-pz",
    "relative_path": "github-recent/mbarbine__v0-fortune-cookie-windshield-pz",
    "remote_url": "git@github.com:mbarbine/v0-fortune-cookie-windshield-pz.git",
    "default_branch": null,
    "current_commit": null
  },
  "languages": [],
  "frameworks": [],
  "packages": {
    "package_manager": null,
    "manifests": []
  },
  "routes": {
    "api_routes": [],
    "app_routes": []
  },
  "components": [],
  "data_models": [],
  "database": {
    "databases": [],
    "schemas": [],
    "migrations": []
  },
  "tests": [],
  "ci": {
    "workflows": []
  },
  "containers": {
    "dockerfiles": [],
    "compose_files": []
  },
  "env": {
    "example_files": [],
    "variables": []
  },
  "configs": [],
  "docs": {
    "readme_paths": [],
    "doc_paths": [],
    "llms_context_paths": []
  },
  "discovery_files": {
    "openapi": [],
    "mcp": [],
    "llms": [],
    "sitemaps": [],
    "feeds": [],
    "well_known": [],
    "robots": [],
    "manifests": []
  },
  "integrations": [],
  "license": {
    "spdx": null,
    "paths": []
  },
  "comments": [],
  "security": {
    "secret_risks": [],
    "unsafe_patterns": [],
    "sensitive_data_indicators": []
  },
  "generated_at": "2026-05-16T16:44:27.704Z"
}
