{
  "schema_version": "1.0.0",
  "scanner": {
    "name": "global-capability-catalog",
    "version": "0.1.0"
  },
  "repo": {
    "id": "github-recent__mbarbine__uberpidgeons-www",
    "name": "mbarbine__uberpidgeons-www",
    "path": "/Users/bwm.barbinewarnermichael/Documents/github/repositories/github-recent/mbarbine__uberpidgeons-www",
    "relative_path": "github-recent/mbarbine__uberpidgeons-www",
    "remote_url": "git@github.com:mbarbine/uberpidgeons-www.git",
    "default_branch": "main",
    "current_commit": "204c847c665a4442a6305537358e3b31111a55ca"
  },
  "languages": [
    {
      "language": "JSON",
      "files": 3,
      "bytes": 215098
    },
    {
      "language": "TypeScript",
      "files": 3,
      "bytes": 4908
    },
    {
      "language": "Markdown",
      "files": 1,
      "bytes": 1450
    },
    {
      "language": "CSS",
      "files": 1,
      "bytes": 488
    },
    {
      "language": "JavaScript",
      "files": 2,
      "bytes": 474
    }
  ],
  "frameworks": [
    {
      "name": "Next.js",
      "confidence": "high",
      "evidence_paths": [
        "package.json"
      ]
    },
    {
      "name": "React",
      "confidence": "high",
      "evidence_paths": [
        "package.json"
      ]
    },
    {
      "name": "Tailwind CSS",
      "confidence": "high",
      "evidence_paths": [
        "package.json"
      ]
    }
  ],
  "packages": {
    "package_manager": "npm",
    "manifests": [
      {
        "path": "package.json",
        "name": "uberpidgeons",
        "version": "0.1.0",
        "scripts": {
          "dev": "next dev --turbopack",
          "build": "next build",
          "start": "next start",
          "lint": "next lint"
        },
        "dependencies": {
          "react": "^19.0.0",
          "react-dom": "^19.0.0",
          "next": "15.3.5"
        },
        "dev_dependencies": {
          "typescript": "^5",
          "@types/node": "^20",
          "@types/react": "^19",
          "@types/react-dom": "^19",
          "@tailwindcss/postcss": "^4",
          "tailwindcss": "^4",
          "eslint": "^9",
          "eslint-config-next": "15.3.5",
          "@eslint/eslintrc": "^3"
        }
      }
    ]
  },
  "routes": {
    "api_routes": [],
    "app_routes": []
  },
  "components": [],
  "data_models": [],
  "database": {
    "databases": [],
    "schemas": [],
    "migrations": []
  },
  "tests": [],
  "ci": {
    "workflows": []
  },
  "containers": {
    "dockerfiles": [],
    "compose_files": []
  },
  "env": {
    "example_files": [],
    "variables": []
  },
  "configs": [
    {
      "path": "eslint.config.mjs"
    },
    {
      "path": "next.config.ts"
    },
    {
      "path": "package.json"
    },
    {
      "path": "postcss.config.mjs"
    },
    {
      "path": "public/vercel.svg"
    },
    {
      "path": "tsconfig.json"
    }
  ],
  "docs": {
    "readme_paths": [
      {
        "path": "README.md"
      }
    ],
    "doc_paths": [],
    "llms_context_paths": []
  },
  "discovery_files": {
    "openapi": [],
    "mcp": [],
    "llms": [],
    "sitemaps": [],
    "feeds": [],
    "well_known": [],
    "robots": [],
    "manifests": []
  },
  "integrations": [],
  "license": {
    "spdx": null,
    "paths": []
  },
  "comments": [],
  "security": {
    "secret_risks": [],
    "unsafe_patterns": [],
    "sensitive_data_indicators": [
      {
        "name": "token",
        "confidence": "medium",
        "evidence_paths": [
          "package-lock.json"
        ]
      }
    ]
  },
  "generated_at": "2026-05-16T16:44:27.356Z"
}
