{
  "schema_version": "1.0.0",
  "scanner": {
    "name": "global-capability-catalog",
    "version": "0.1.0"
  },
  "repo": {
    "id": "github-recent__mbarbine__glass-blowing-website",
    "name": "mbarbine__glass-blowing-website",
    "path": "/Users/bwm.barbinewarnermichael/Documents/github/repositories/github-recent/mbarbine__glass-blowing-website",
    "relative_path": "github-recent/mbarbine__glass-blowing-website",
    "remote_url": "git@github.com:mbarbine/glass-blowing-website.git",
    "default_branch": "main",
    "current_commit": "7d2646c0ba9789f22d866fd5e02d74b206991bd5"
  },
  "languages": [
    {
      "language": "YAML",
      "files": 1,
      "bytes": 130829
    },
    {
      "language": "TypeScript",
      "files": 16,
      "bytes": 39478
    },
    {
      "language": "CSS",
      "files": 2,
      "bytes": 10900
    },
    {
      "language": "JSON",
      "files": 3,
      "bytes": 3312
    },
    {
      "language": "Markdown",
      "files": 2,
      "bytes": 1956
    },
    {
      "language": "JavaScript",
      "files": 2,
      "bytes": 372
    }
  ],
  "frameworks": [
    {
      "name": "Next.js",
      "confidence": "high",
      "evidence_paths": [
        "package.json"
      ]
    },
    {
      "name": "React",
      "confidence": "high",
      "evidence_paths": [
        "package.json"
      ]
    },
    {
      "name": "Tailwind CSS",
      "confidence": "high",
      "evidence_paths": [
        "package.json"
      ]
    }
  ],
  "packages": {
    "package_manager": "pnpm",
    "manifests": [
      {
        "path": "package.json",
        "name": "my-v0-project",
        "version": "0.1.0",
        "scripts": {
          "build": "next build",
          "dev": "next dev",
          "lint": "next lint",
          "start": "next start"
        },
        "dependencies": {
          "@hookform/resolvers": "^3.10.0",
          "@radix-ui/react-accordion": "1.2.2",
          "@radix-ui/react-alert-dialog": "1.1.4",
          "@radix-ui/react-aspect-ratio": "1.1.1",
          "@radix-ui/react-avatar": "1.1.2",
          "@radix-ui/react-checkbox": "1.1.3",
          "@radix-ui/react-collapsible": "1.1.2",
          "@radix-ui/react-context-menu": "2.2.4",
          "@radix-ui/react-dialog": "1.1.4",
          "@radix-ui/react-dropdown-menu": "2.1.4",
          "@radix-ui/react-hover-card": "1.1.4",
          "@radix-ui/react-label": "2.1.1",
          "@radix-ui/react-menubar": "1.1.4",
          "@radix-ui/react-navigation-menu": "1.2.3",
          "@radix-ui/react-popover": "1.1.4",
          "@radix-ui/react-progress": "1.1.1",
          "@radix-ui/react-radio-group": "1.2.2",
          "@radix-ui/react-scroll-area": "1.2.2",
          "@radix-ui/react-select": "2.1.4",
          "@radix-ui/react-separator": "1.1.1",
          "@radix-ui/react-slider": "1.2.2",
          "@radix-ui/react-slot": "latest",
          "@radix-ui/react-switch": "1.1.2",
          "@radix-ui/react-tabs": "1.1.2",
          "@radix-ui/react-toast": "1.2.4",
          "@radix-ui/react-toggle": "1.1.1",
          "@radix-ui/react-toggle-group": "1.1.1",
          "@radix-ui/react-tooltip": "1.1.6",
          "@vercel/analytics": "latest",
          "autoprefixer": "^10.4.20",
          "class-variance-authority": "^0.7.1",
          "clsx": "^2.1.1",
          "cmdk": "1.0.4",
          "date-fns": "4.1.0",
          "embla-carousel-react": "8.5.1",
          "geist": "^1.3.1",
          "input-otp": "1.4.1",
          "lucide-react": "^0.454.0",
          "next": "15.2.8",
          "next-themes": "latest",
          "react": "^19",
          "react-day-picker": "9.8.0",
          "react-dom": "^19",
          "react-hook-form": "^7.60.0",
          "react-resizable-panels": "^2.1.7",
          "recharts": "2.15.4",
          "sonner": "^1.7.4",
          "tailwind-merge": "^2.5.5",
          "tailwindcss-animate": "^1.0.7",
          "vaul": "^0.9.9",
          "zod": "3.25.67"
        },
        "dev_dependencies": {
          "@tailwindcss/postcss": "^4.1.9",
          "@types/node": "^22",
          "@types/react": "^19",
          "@types/react-dom": "^19",
          "postcss": "^8.5",
          "tailwindcss": "^4.1.9",
          "tw-animate-css": "1.3.3",
          "typescript": "^5"
        }
      }
    ]
  },
  "routes": {
    "api_routes": [],
    "app_routes": []
  },
  "components": [
    {
      "name": "artisan-stories",
      "kind": "ui-component",
      "source_path": "components/artisan-stories.tsx"
    },
    {
      "name": "featured-collections",
      "kind": "ui-component",
      "source_path": "components/featured-collections.tsx"
    },
    {
      "name": "footer",
      "kind": "ui-component",
      "source_path": "components/footer.tsx"
    },
    {
      "name": "header",
      "kind": "ui-component",
      "source_path": "components/header.tsx"
    },
    {
      "name": "hero",
      "kind": "ui-component",
      "source_path": "components/hero.tsx"
    },
    {
      "name": "newsletter",
      "kind": "ui-component",
      "source_path": "components/newsletter.tsx"
    },
    {
      "name": "promotional-offer",
      "kind": "ui-component",
      "source_path": "components/promotional-offer.tsx"
    },
    {
      "name": "testimonials",
      "kind": "ui-component",
      "source_path": "components/testimonials.tsx"
    },
    {
      "name": "theme-provider",
      "kind": "ui-component",
      "source_path": "components/theme-provider.tsx"
    },
    {
      "name": "trail-proximity",
      "kind": "ui-component",
      "source_path": "components/trail-proximity.tsx"
    },
    {
      "name": "button",
      "kind": "ui-component",
      "source_path": "components/ui/button.tsx"
    },
    {
      "name": "card",
      "kind": "ui-component",
      "source_path": "components/ui/card.tsx"
    },
    {
      "name": "input",
      "kind": "ui-component",
      "source_path": "components/ui/input.tsx"
    }
  ],
  "data_models": [],
  "database": {
    "databases": [],
    "schemas": [],
    "migrations": []
  },
  "tests": [],
  "ci": {
    "workflows": []
  },
  "containers": {
    "dockerfiles": [],
    "compose_files": []
  },
  "env": {
    "example_files": [],
    "variables": []
  },
  "configs": [
    {
      "path": "next.config.mjs"
    },
    {
      "path": "package.json"
    },
    {
      "path": "postcss.config.mjs"
    },
    {
      "path": "tsconfig.json"
    }
  ],
  "docs": {
    "readme_paths": [
      {
        "path": "README.md"
      }
    ],
    "doc_paths": [],
    "llms_context_paths": []
  },
  "discovery_files": {
    "openapi": [],
    "mcp": [],
    "llms": [],
    "sitemaps": [],
    "feeds": [],
    "well_known": [],
    "robots": [],
    "manifests": []
  },
  "integrations": [
    {
      "name": "Vercel",
      "confidence": "medium",
      "evidence_paths": [
        "app/layout.tsx",
        "package.json",
        "pnpm-lock.yaml"
      ]
    }
  ],
  "license": {
    "spdx": null,
    "paths": []
  },
  "comments": [
    {
      "kind": "deprecated",
      "source_path": "pnpm-lock.yaml",
      "line": 1736,
      "text": "deprecated: Old versions of tar are not supported, and contain widely publicized security vulnerabilities, which have been fixed in the current version. Please update. Support for old versions may be purchased (at exorbitant rates) by conta"
    }
  ],
  "security": {
    "secret_risks": [],
    "unsafe_patterns": [],
    "sensitive_data_indicators": [
      {
        "name": "card",
        "confidence": "medium",
        "evidence_paths": [
          "app/globals.css",
          "components/artisan-stories.tsx",
          "components/featured-collections.tsx",
          "components/testimonials.tsx",
          "components/trail-proximity.tsx",
          "components/ui/card.tsx",
          "package.json",
          "pnpm-lock.yaml",
          "styles/globals.css"
        ]
      },
      {
        "name": "email",
        "confidence": "medium",
        "evidence_paths": [
          "components/newsletter.tsx"
        ]
      },
      {
        "name": "location",
        "confidence": "medium",
        "evidence_paths": [
          "components/header.tsx",
          "components/testimonials.tsx",
          "components/trail-proximity.tsx"
        ]
      },
      {
        "name": "pii",
        "confidence": "medium",
        "evidence_paths": [
          "pnpm-lock.yaml"
        ]
      },
      {
        "name": "token",
        "confidence": "medium",
        "evidence_paths": [
          "pnpm-lock.yaml"
        ]
      }
    ]
  },
  "generated_at": "2026-05-16T16:44:08.706Z"
}
