{
  "schema_version": "1.0.0",
  "scanner": {
    "name": "global-capability-catalog",
    "version": "0.1.0"
  },
  "repo": {
    "id": "github-recent__mbarbine__tools",
    "name": "mbarbine__tools",
    "path": "/Users/bwm.barbinewarnermichael/Documents/github/repositories/github-recent/mbarbine__tools",
    "relative_path": "github-recent/mbarbine__tools",
    "remote_url": "git@github.com:mbarbine/tools.git",
    "default_branch": "main",
    "current_commit": "5a182a9a47d3ebdf40b962de3aaa023a0958dd91"
  },
  "languages": [
    {
      "language": "Shell",
      "files": 1,
      "bytes": 3894
    },
    {
      "language": "Markdown",
      "files": 1,
      "bytes": 7
    }
  ],
  "frameworks": [],
  "packages": {
    "package_manager": null,
    "manifests": []
  },
  "routes": {
    "api_routes": [],
    "app_routes": []
  },
  "components": [],
  "data_models": [],
  "database": {
    "databases": [],
    "schemas": [],
    "migrations": []
  },
  "tests": [],
  "ci": {
    "workflows": []
  },
  "containers": {
    "dockerfiles": [],
    "compose_files": []
  },
  "env": {
    "example_files": [],
    "variables": []
  },
  "configs": [],
  "docs": {
    "readme_paths": [
      {
        "path": "README.md"
      }
    ],
    "doc_paths": [],
    "llms_context_paths": []
  },
  "discovery_files": {
    "openapi": [],
    "mcp": [],
    "llms": [],
    "sitemaps": [],
    "feeds": [],
    "well_known": [],
    "robots": [],
    "manifests": []
  },
  "integrations": [],
  "license": {
    "spdx": null,
    "paths": []
  },
  "comments": [],
  "security": {
    "secret_risks": [],
    "unsafe_patterns": [],
    "sensitive_data_indicators": [
      {
        "name": "location",
        "confidence": "medium",
        "evidence_paths": [
          "wayback_save_now.sh"
        ]
      }
    ]
  },
  "generated_at": "2026-05-16T16:44:27.085Z"
}
