{
  "schema_version": "1.0.0",
  "scanner": {
    "name": "global-capability-catalog",
    "version": "0.1.0"
  },
  "repo": {
    "id": "github-recent__ph3ar__demo-repository",
    "name": "ph3ar__demo-repository",
    "path": "/Users/bwm.barbinewarnermichael/Documents/github/repositories/github-recent/ph3ar__demo-repository",
    "relative_path": "github-recent/ph3ar__demo-repository",
    "remote_url": "git@github.com:ph3ar/demo-repository.git",
    "default_branch": "main",
    "current_commit": "af86e0877a79417c94b34f65438805da118b9606"
  },
  "languages": [
    {
      "language": "YAML",
      "files": 2,
      "bytes": 579
    },
    {
      "language": "Markdown",
      "files": 1,
      "bytes": 305
    },
    {
      "language": "JSON",
      "files": 1,
      "bytes": 163
    },
    {
      "language": "HTML",
      "files": 1,
      "bytes": 64
    }
  ],
  "frameworks": [],
  "packages": {
    "package_manager": "npm",
    "manifests": [
      {
        "path": "package.json",
        "name": "demo-repo",
        "version": "0.2.0",
        "scripts": {},
        "dependencies": {
          "@primer/css": "17.0.1"
        },
        "dev_dependencies": {}
      }
    ]
  },
  "routes": {
    "api_routes": [],
    "app_routes": []
  },
  "components": [],
  "data_models": [],
  "database": {
    "databases": [],
    "schemas": [],
    "migrations": []
  },
  "tests": [],
  "ci": {
    "workflows": [
      {
        "path": ".github/workflows/auto-assign.yml"
      },
      {
        "path": ".github/workflows/proof-html.yml"
      }
    ]
  },
  "containers": {
    "dockerfiles": [],
    "compose_files": []
  },
  "env": {
    "example_files": [],
    "variables": []
  },
  "configs": [
    {
      "path": "package.json"
    }
  ],
  "docs": {
    "readme_paths": [
      {
        "path": "README.md"
      }
    ],
    "doc_paths": [],
    "llms_context_paths": []
  },
  "discovery_files": {
    "openapi": [],
    "mcp": [],
    "llms": [],
    "sitemaps": [],
    "feeds": [],
    "well_known": [],
    "robots": [],
    "manifests": []
  },
  "integrations": [],
  "license": {
    "spdx": null,
    "paths": []
  },
  "comments": [],
  "security": {
    "secret_risks": [],
    "unsafe_patterns": [],
    "sensitive_data_indicators": [
      {
        "name": "token",
        "confidence": "medium",
        "evidence_paths": [
          ".github/workflows/auto-assign.yml"
        ]
      }
    ]
  },
  "generated_at": "2026-05-16T16:44:30.798Z"
}
