{
  "schema_version": "1.0.0",
  "scanner": {
    "name": "global-capability-catalog",
    "version": "0.1.0"
  },
  "repo": {
    "id": "github-recent__process-co__npm-element-types",
    "name": "process-co__npm-element-types",
    "path": "/Users/bwm.barbinewarnermichael/Documents/github/repositories/github-recent/process-co__npm-element-types",
    "relative_path": "github-recent/process-co__npm-element-types",
    "remote_url": "git@github.com:process-co/npm-element-types.git",
    "default_branch": "main",
    "current_commit": "ea415ca15081248de90cfde4839c87b6a47d9d21"
  },
  "languages": [
    {
      "language": "TypeScript",
      "files": 10,
      "bytes": 50988
    },
    {
      "language": "Markdown",
      "files": 2,
      "bytes": 3558
    },
    {
      "language": "YAML",
      "files": 1,
      "bytes": 2529
    },
    {
      "language": "JSON",
      "files": 1,
      "bytes": 782
    }
  ],
  "frameworks": [],
  "packages": {
    "package_manager": "npm",
    "manifests": [
      {
        "path": "package.json",
        "name": "@process.co/element-types",
        "version": "0.0.0-development",
        "scripts": {
          "build": "tsc"
        },
        "dependencies": {
          "zod": "npm:zod@4.3.6"
        },
        "dev_dependencies": {
          "@repo/config-typescript": "workspace:^",
          "@types/node": "^22.13.14",
          "typescript": "^5.7.3"
        }
      }
    ]
  },
  "routes": {
    "api_routes": [],
    "app_routes": []
  },
  "components": [],
  "data_models": [],
  "database": {
    "databases": [],
    "schemas": [
      {
        "path": "src/zod-container-export-json-schema.ts"
      }
    ],
    "migrations": []
  },
  "tests": [],
  "ci": {
    "workflows": [
      {
        "path": ".github/workflows/publish-element-types.yml"
      }
    ]
  },
  "containers": {
    "dockerfiles": [],
    "compose_files": []
  },
  "env": {
    "example_files": [],
    "variables": []
  },
  "configs": [
    {
      "path": "package.json"
    }
  ],
  "docs": {
    "readme_paths": [
      {
        "path": ".github/README.md"
      },
      {
        "path": "README.md"
      }
    ],
    "doc_paths": [],
    "llms_context_paths": []
  },
  "discovery_files": {
    "openapi": [],
    "mcp": [],
    "llms": [],
    "sitemaps": [],
    "feeds": [],
    "well_known": [],
    "robots": [],
    "manifests": []
  },
  "integrations": [],
  "license": {
    "spdx": null,
    "paths": []
  },
  "comments": [],
  "security": {
    "secret_risks": [],
    "unsafe_patterns": [],
    "sensitive_data_indicators": [
      {
        "name": "email",
        "confidence": "medium",
        "evidence_paths": [
          "package.json",
          "src/index.ts"
        ]
      },
      {
        "name": "oauth",
        "confidence": "medium",
        "evidence_paths": [
          "src/authoring-contract-types.ts",
          "src/authoring-contract.ts",
          "src/index.ts",
          "src/process-element-cli-output.ts"
        ]
      },
      {
        "name": "password",
        "confidence": "medium",
        "evidence_paths": [
          "src/index.ts"
        ]
      },
      {
        "name": "token",
        "confidence": "medium",
        "evidence_paths": [
          ".github/workflows/publish-element-types.yml",
          "src/index.ts"
        ]
      }
    ]
  },
  "generated_at": "2026-05-16T16:44:32.412Z"
}
